{
  "branch": "main",
  "completeness": "COMPLETE",
  "date_resolution_method": "LATEST_COMPLETE_GROUP",
  "directory": "Ai_Engr_Rpt/Daily/medicodio/Detail",
  "files_discovered": [
    "2026_08_19_Employee_Rating_Cards.md",
    "2026_08_20_Employee_Rating_Cards.md",
    "2026_08_20_Mgmt_Activity_Report.md",
    "2026_08_21_Employee_Rating_Cards.md",
    "2026_08_21_Mgmt_Activity_Report.md",
    "2026_08_22_Employee_Rating_Cards.md",
    "2026_08_22_Mgmt_Activity_Report.md",
    "2026_08_23_Employee_Rating_Cards.md",
    "2026_08_23_Mgmt_Activity_Report.md",
    "2026_09_15_Employee_Rating_Cards.md",
    "2026_09_15_Mgmt_Activity_Report.md"
  ],
  "human_action_required": null,
  "missing_sources": [],
  "next_expected_input_file": null,
  "next_state": "00_INTAKE",
  "report_date": "2026_09_15",
  "repository": "Medicodio-AI-Engine/Mgmt_Reports",
  "requested_report_date": null,
  "required_sources_present": true,
  "resolved_report_date": "2026_09_15",
  "run_flags": [],
  "run_id": "RUN_0005",
  "source_directory": "Ai_Engr_Rpt/Daily/medicodio/Detail",
  "source_files": [
    {
      "classification_evidence": [
        "filename matches EMPLOYEE_RATING_CARDS naming",
        "content indicators: automation of repetitive work, delivery & follow-through, employee rating cards, engineering rigor"
      ],
      "content_review_date": null,
      "date_verified": false,
      "excluded": false,
      "exclusion_reason": null,
      "file_format": "MD",
      "filename": "2026_09_15_Employee_Rating_Cards.md",
      "filename_date": "2026_09_15",
      "normalized_date": "2026_09_15",
      "report_type": "EMPLOYEE_RATING_CARDS",
      "repository_path": "2026_09_15_Employee_Rating_Cards.md",
      "source_id": "SOURCE_010"
    },
    {
      "classification_evidence": [
        "filename matches DAILY_ENGINEERING_DETAIL naming",
        "content indicators: activities completed, daily team summary, devin usage, individual reviews"
      ],
      "content_review_date": null,
      "date_verified": false,
      "excluded": false,
      "exclusion_reason": null,
      "file_format": "MD",
      "filename": "2026_09_15_Mgmt_Activity_Report.md",
      "filename_date": "2026_09_15",
      "normalized_date": "2026_09_15",
      "report_type": "DAILY_ENGINEERING_DETAIL",
      "repository_path": "2026_09_15_Mgmt_Activity_Report.md",
      "source_id": "SOURCE_011"
    }
  ],
  "warnings": []
}
