{
  "branch": "main",
  "completeness": "COMPLETE",
  "date_resolution_method": "LATEST_COMPLETE_GROUP",
  "directory": "Ai_Engr_Rpt/Daily/medicodio/Detail",
  "files_discovered": [
    "employee-rating-cards-2026-08-19.md",
    "employee-rating-cards-2026-08-23.md",
    "mgmt-activity-report-2026-08-23.md"
  ],
  "human_action_required": null,
  "missing_sources": [],
  "next_expected_input_file": null,
  "next_state": "00_INTAKE",
  "report_date": "2026_08_23",
  "repository": "Medicodio-AI-Engine/Mgmt_Reports",
  "requested_report_date": null,
  "required_sources_present": true,
  "resolved_report_date": "2026_08_23",
  "run_flags": [],
  "run_id": "RUN_0001",
  "source_directory": "Ai_Engr_Rpt/Daily/medicodio/Detail",
  "source_files": [
    {
      "classification_evidence": [
        "filename matches EMPLOYEE_RATING_CARDS naming",
        "content indicators: employee rating cards, summary grid"
      ],
      "content_review_date": "2026_08_23",
      "date_verified": true,
      "excluded": false,
      "exclusion_reason": null,
      "file_format": "MD",
      "filename": "employee-rating-cards-2026-08-23.md",
      "filename_date": "2026_08_23",
      "normalized_date": "2026_08_23",
      "report_type": "EMPLOYEE_RATING_CARDS",
      "repository_path": "employee-rating-cards-2026-08-23.md",
      "source_id": "SOURCE_002"
    },
    {
      "classification_evidence": [
        "filename matches DAILY_ENGINEERING_DETAIL naming",
        "content indicators: activities completed, daily team summary, devin usage, individual reviews"
      ],
      "content_review_date": "2026_08_23",
      "date_verified": true,
      "excluded": false,
      "exclusion_reason": null,
      "file_format": "MD",
      "filename": "mgmt-activity-report-2026-08-23.md",
      "filename_date": "2026_08_23",
      "normalized_date": "2026_08_23",
      "report_type": "DAILY_ENGINEERING_DETAIL",
      "repository_path": "mgmt-activity-report-2026-08-23.md",
      "source_id": "SOURCE_003"
    }
  ],
  "warnings": []
}
