{
  "branch": "main",
  "completeness": "PARTIAL",
  "date_resolution_method": "EXPLICIT_ARGUMENT",
  "directory": "Ai_Engr_Rpt/Daily/medicodio/Detail",
  "files_discovered": [
    "2026_08_19_Employee_Rating_Cards.md",
    "2026_08_20_Employee_Rating_Cards.md",
    "2026_08_20_Mgmt_Activity_Report.md",
    "2026_08_21_Employee_Rating_Cards.md",
    "2026_08_21_Mgmt_Activity_Report.md",
    "2026_08_22_Employee_Rating_Cards.md",
    "2026_08_22_Mgmt_Activity_Report.md",
    "2026_08_23_Employee_Rating_Cards.md",
    "2026_08_23_Mgmt_Activity_Report.md",
    "2026_08_29_Employee_Rating_Cards.md",
    "2026_08_29_Mgmt_Activity_Report.md"
  ],
  "human_action_required": null,
  "missing_sources": [
    "DAILY_ENGINEERING_DETAIL"
  ],
  "next_expected_input_file": null,
  "next_state": "00_INTAKE",
  "report_date": "2026_08_29",
  "repository": "Medicodio-AI-Engine/Mgmt_Reports",
  "requested_report_date": "2026_08_29",
  "required_sources_present": false,
  "resolved_report_date": "2026_08_29",
  "run_flags": [
    "PARTIAL_SOURCE_DATA"
  ],
  "run_id": "RUN_0005",
  "source_directory": "Ai_Engr_Rpt/Daily/medicodio/Detail",
  "source_files": [
    {
      "classification_evidence": [
        "filename matches EMPLOYEE_RATING_CARDS naming",
        "content indicators: automation of repetitive work, delivery & follow-through, employee rating cards, engineering rigor"
      ],
      "content_review_date": null,
      "date_verified": false,
      "excluded": false,
      "exclusion_reason": null,
      "file_format": "MD",
      "filename": "2026_08_29_Employee_Rating_Cards.md",
      "filename_date": "2026_08_29",
      "normalized_date": "2026_08_29",
      "report_type": "EMPLOYEE_RATING_CARDS",
      "repository_path": "2026_08_29_Employee_Rating_Cards.md",
      "source_id": "SOURCE_010"
    },
    {
      "classification_evidence": [
        "filename matches DAILY_ENGINEERING_DETAIL naming",
        "content indicators: activities completed, daily team summary, devin usage, individual reviews"
      ],
      "content_review_date": "2026_08_26",
      "date_verified": false,
      "excluded": true,
      "exclusion_reason": "DATE_MISMATCH",
      "file_format": "MD",
      "filename": "2026_08_29_Mgmt_Activity_Report.md",
      "filename_date": "2026_08_29",
      "normalized_date": "2026_08_29",
      "report_type": "DAILY_ENGINEERING_DETAIL",
      "repository_path": "2026_08_29_Mgmt_Activity_Report.md",
      "source_id": "SOURCE_011"
    }
  ],
  "warnings": [
    "DATE_MISMATCH: filename date and stated review date disagree; artifact excluded from automatic processing",
    "PARTIAL: missing DAILY_ENGINEERING_DETAIL; run continues in analysis-only mode with reduced confidence"
  ]
}
